ano,fonte,categoria,evento,quantidade,valor_brl,detalhe,url
2021-05,Receita Federal,destruicao,TV boxes piratas destruídas,97000,13612026.25,"carga destruída no RJ; resultado de operações de 2019 e 2020",https://www.gov.br/receitafederal/pt-br/assuntos/noticias/2021/maio/receita-federal-e-associacao-brasileira-de-televisao-por-assinatura-destroem-mais-de-97-mil-aparelhos-de-tv-box-piratas-no-rio-de-janeiro
2021-05,ABTA/Receita,estimativa,Lares com TV boxes ilegais,4500000,9500000000,"estimativa da ABTA baseada em dados do IBGE e da Anatel",https://www.gov.br/receitafederal/pt-br/assuntos/noticias/2021/maio/receita-federal-e-associacao-brasileira-de-televisao-por-assinatura-destroem-mais-de-97-mil-aparelhos-de-tv-box-piratas-no-rio-de-janeiro
2022-12,Anatel,apreensao,Produtos não homologados retirados do mercado em 2 anos,3800000,468600000,"desse total, 1,1 milhão eram TV boxes",https://www.gov.br/anatel/pt-br/assuntos/noticias/anatel-constata-presenca-de-malware-em-aparelhos-de-tv-box-nao-homologados
2022-12,Anatel,apreensao,TV boxes entre os produtos retirados,1100000,0,"subconjunto citado pela Anatel no estudo de engenharia reversa",https://www.gov.br/anatel/pt-br/assuntos/noticias/anatel-constata-novas-vulnerabilidades-em-tv-box-nao-homologados
2025-08,Anatel,alerta,Dispositivos infectados no Brasil por BadBox 2.0,1800000,0,"número informado no alerta da Anatel sobre BadBox 2.0",https://www.gov.br/anatel/pt-br/assuntos/noticias/anatel-emite-alerta-sobre-malware-bad-box-2-0-em-tv-boxes-piratas
2025-11,Anatel,apreensao,Produtos não homologados retirados desde 2018 até out/2025,8000000,833600000,"smart TV boxes entre as principais categorias apreendidas",https://www.gov.br/mcom/pt-br/noticias/2025/novembro/anatel-retira-de-circulacao-mais-de-8-milhoes-de-produtos-de-telecomunicacoes-por-falta-de-homologacao-correspondendo-a-r-833-6-milhoes
2026-01,MCom,estimativa,Usuários recorrentes de IPTV pirata,4000000,0,"estimativa oficial do Governo do Brasil para uso recorrente",https://www.gov.br/mcom/pt-br/noticias/2026/janeiro/brasil-intensifica-combate-a-pirataria-digital-em-2025-com-apreensao-milionaria-e-mapeamento-de-ate-8-milhoes-de-usuarios-clandestinos
2026-01,MCom,estimativa,Usuários recorrentes + eventuais,7000000,0,"faixa ampliada com compartilhamento de acessos e consumidores eventuais",https://www.gov.br/mcom/pt-br/noticias/2026/janeiro/brasil-intensifica-combate-a-pirataria-digital-em-2025-com-apreensao-milionaria-e-mapeamento-de-ate-8-milhoes-de-usuarios-clandestinos
